{
  "run_id": "cifar10-smoke-001",
  "dataset_manifest": "context_harness/manifests/datasets/cifar10.json",
  "method_manifest": "context_harness/manifests/methods/cifar10_resnet18_smoke.json",
  "seed": 3407,
  "execution_target": "colab_mcp_a100",
  "budget": {
    "max_hours": 1.5,
    "max_gpu_count": 1
  },
  "artifacts": {
    "training_log": "experiment_log/training_run_cifar10-smoke-001.json",
    "checkpoint_dir": "checkpoints/cifar10-smoke-001/"
  },
  "stop_conditions": [
    "training diverges for 3 consecutive epochs",
    "critic approval missing",
    "reproduction command not logged",
    "OOM persists after one batch-size reduction"
  ]
}
