{
  "run_id": "cifar100-wrn28x10-late-sam-001",
  "dataset_manifest": "context_harness/manifests/datasets/cifar100.json",
  "method_manifest": "context_harness/manifests/methods/cifar100_wrn28x10_late_sam.json",
  "execution_target": "colab_mcp_a100",
  "seed": 3407,
  "artifacts": {
    "training_log": "experiment_log/training_run_cifar100-wrn28x10-late-sam-001.json",
    "checkpoint_dir": "checkpoints/cifar100-wrn28x10-late-sam-001/"
  },
  "stop_conditions": [
    "validation_loss_increases_3_times",
    "oom_after_batch_size_reduction",
    "missing_colab_session"
  ]
}
