{
  "run_id": "birdclef2026-effnet-b0-gem-001",
  "dataset_manifest": "context_harness/manifests/datasets/birdclef2026.json",
  "method_manifest": "context_harness/manifests/methods/birdclef2026_effnet_b0_gem.json",
  "seed": 3407,
  "execution_target": "colab_mcp_a100",
  "comparison_group": "birdclef2026_audio_backbone_suite_v2",
  "baseline_run_id": "",
  "ablation_axis": "backbone",
  "pseudo_label_round": 0,
  "ensemble_group": "birdclef2026_phase1_single_model_pool",
  "budget": {
    "max_hours": 6,
    "max_gpu_count": 1,
    "max_submission_inference_minutes": 120
  },
  "artifacts": {
    "training_log": "experiment_log/training_run_birdclef2026-effnet-b0-gem-001.json",
    "checkpoint_dir": "checkpoints/birdclef2026-effnet-b0-gem-001/",
    "submission_csv": "experiment_log/submission_birdclef2026-effnet-b0-gem-001.csv"
  },
  "stop_conditions": [
    "missing_drive_mount",
    "missing_colab_session",
    "oom_after_batch_size_reduction"
  ],
  "notes": [
    "Primary competition-aligned CNN baseline.",
    "Select by macro AUROC first, then inspect calibration and inference budget."
  ]
}
